<?xml version="1.0" encoding="utf-8"?>
<root xmlns:xs="http://www.w3.org/2001/XMLSchema-instance" 
      xs:noNamespaceSchemaLocation="Schema.xsd">
  <band name="MyBand" size="2">
    <member name="John Doe" instrument="Voice" />
    <member name="Jane Smith" instrument="Piano" />
    <album name="Album1">
      <song>
        <name>Track1</name>
        <trackLength>PT1M20S</trackLength>
      </song>
      <song>
        <name>Track2</name>
        <trackLength>PT3M45S</trackLength>
      </song>
      <reviewer ref="PressID1">This album was awesome</reviewer>
    </album>
    <show>
      <date>2014-01-23</date>
      <venue>Air Canada Center</venue>
      <date>2014-02-14</date>
      <venue>Molson Amplitheater</venue>
    </show>
  </band>
  <band name="YourBand" size="1">
    <member name="Joe Smith" instrument="Guitar"/>
    <album name="MyFirstAlbum">
      <song>
        <name>A great song</name>
        <trackLength>PT5M32S</trackLength>
      </song>
      <reviewer ref="PressID2">This album is not very good</reviewer>
    </album>
  </band>
  <reviewer id="PressID1">
    <name>Name1</name>
  </reviewer>
  <reviewer id="PressID2">
    <name>Name2</name>
    <company>New York Times</company>
  </reviewer>
  <reviewer id="PressID3">
    <name>Name3</name>
    <company>New York Times</company>
  </reviewer>
</root>